{
  "test_id": "michael_mueller_001",
  "name": "Michael Müller - Diabetes & Rückenschmerzen",
  "description": "Standard consultation with medication changes, refused medications, and vital sign measurement",
  "language": "de",
  
  "transcript": "Dr. Hausmann: 'So, Herr Müller. Lange nicht gesehen. Wie geht es Ihnen? Haben Sie das Parkplatzproblem draußen gesehen? Katastrophe heute.' Herr Müller: 'Ach hören Sie mir auf. Ich musste drei Runden drehen. Aber gut, ich bin ja da. Eigentlich geht es mir ganz gut, nur der Rücken zwickt und mein Zucker macht was er will.' Dr. Hausmann: 'Okay, schauen wir mal drauf. Nehmen Sie das Metformin noch regelmäßig? Die 1000er?' Herr Müller: 'Ja, morgens und abends eine. Aber meine Frau meinte, ich soll mal dieses Ozempic probieren, das nimmt ihre Schwester zum Abnehmen.' Dr. Hausmann: 'Moment, eins nach dem anderen. Also Metformin 1000 mg, 1-0-1, das bleibt so. Das steht fest. Zu Ozempic: Nein, das verschreibe ich Ihnen heute nicht. Ihre Werte sind dafür nicht schlecht genug und wir haben Lieferengpässe. Vergessen Sie das erst mal wieder.' Herr Müller: 'Schade. Naja. Und wegen dem Rücken? Ich habe noch diese Tropfen von letztem Jahr... Tramadol oder so?' Dr. Hausmann: 'Haben Sie die noch zu Hause?' Herr Müller: 'Ja, da ist noch eine halbe Flasche.' Dr. Hausmann: 'Bitte entsorgen Sie die sofort. Tramadol ist für Ihre jetzigen Beschwerden viel zu stark und macht schwindelig. Nehmen Sie die auf keinen Fall weiter.' Herr Müller: 'Okay, weg damit. Was dann?' Dr. Hausmann: 'Ich schreibe Ihnen Ibuprofen 600 auf... nein, warten Sie. Ich sehe gerade in der Akte, Ihre Nierenwerte waren grenzwertig. GFR unter 60. Da traue ich mich nicht an die 600er ran. Wir machen Folgendes: Ich verschreibe Ihnen Novalgin Tropfen. Metamizol.' Herr Müller: 'Die bitteren?' Dr. Hausmann: 'Genau die. Nehmen Sie bei Bedarf 20 bis 30 Tropfen. Aber maximal viermal am Tag. Nicht mehr.' Herr Müller: 'Alles klar. Und mein Blutdruck? Das Ramipril?' Dr. Hausmann: 'Wie viel nehmen Sie da gerade?' Herr Müller: 'Die 5 mg morgens.' Dr. Hausmann: 'Der Druck ist heute mit 160 zu 90 deutlich zu hoch. Wir verdoppeln das. Ab morgen nehmen Sie bitte die Ramipril 10 mg. Ich gebe Ihnen ein neues Rezept mit.' Herr Müller: 'Also die 5er wegwerfen?' Dr. Hausmann: 'Nein, nehmen Sie einfach zwei von den 5ern, bis die Packung leer ist, danach die neuen 10er. Und ich brauche noch ein Labor. Schwester Ute kommt gleich.' Herr Müller: 'Gut. Ach, eine Sache noch: Ich fliege nächste Woche nach Mallorca. Brauche ich da eine Thrombosespritze?' Dr. Hausmann: 'Für Mallorca? Nein, der Flug ist zu kurz. Trinken Sie viel Wasser, bewegen Sie die Beine. Keine Spritze notwendig.'",

  "ground_truth": {
    "medications_taken": [
      {
        "name": "Metformin",
        "dose": "1000 mg",
        "frequency": "1-0-1",
        "indication": "Diabetes"
      },
      {
        "name": "Ramipril",
        "dose": "5 mg",
        "frequency": "morgens",
        "indication": "Blutdruck"
      }
    ],
    
    "medications_planned": [
      {
        "name": "Ozempic",
        "action": "refused",
        "reason": "Werte nicht schlecht genug, Lieferengpässe"
      },
      {
        "name": "Tramadol",
        "action": "stopped",
        "reason": "Zu stark, macht schwindelig"
      },
      {
        "name": "Ibuprofen",
        "action": "refused",
        "reason": "Grenzwertige Nierenwerte (GFR <60)"
      },
      {
        "name": "Novalgin Tropfen",
        "action": "new",
        "dose": "20-30 Tropfen",
        "frequency": "bei Bedarf max 4x täglich",
        "indication": "Rückenschmerzen"
      },
      {
        "name": "Ramipril",
        "action": "changed",
        "dose": "10 mg",
        "frequency": "täglich",
        "reason": "Blutdruck zu hoch"
      },
      {
        "name": "Thrombosespritze",
        "action": "refused",
        "reason": "Flug zu kurz"
      }
    ],
    
    "all_medication_names": [
      "Metformin",
      "Ozempic",
      "Tramadol",
      "Ibuprofen",
      "Novalgin Tropfen",
      "Metamizol",
      "Ramipril",
      "Thrombosespritze"
    ],
    
    "vital_measurements": [
      {
        "parameter": "Blutdruck",
        "value": "160/90",
        "unit": "mmHg",
        "source": "doctor_measured"
      }
    ],
    
    "symptoms": [
      "Rücken zwickt",
      "Blutzucker macht was er will"
    ],
    
    "medical_history": [
      "Grenzwertige Nierenwerte (GFR <60)"
    ],
    
    "family_history": [],
    
    "diagnostic_plans": [
      "Labor"
    ],
    
    "therapeutic_interventions": [
      "Tramadol-Reste sofort entsorgen",
      "Viel Wasser trinken auf Flug",
      "Beine bewegen auf Flug"
    ],
    
    "forbidden_medications": [
      "Risperidon",
      "Diazepam",
      "Citalopram",
      "Alprazolam",
      "Lorazepam",
      "Sertralin",
      "Fluoxetin"
    ]
  }
}
